question,answer,retrieved_texts,page_nums,bboxes
What is the name of the dataset created by the authors to evaluate their framework against human judgments?,The name of the dataset created by the authors to evaluate their framework against human judgments is **WikiEval**.,"Chunk 1: number of extracted sentences All questions were annotated along the three con- CR (2) sidered quality dimensions by two annotators. Both total number of sentences in c(q) annotators were fluent in English and were given The WikiEval Dataset 4 clear instructions about the meaning of the three considered quality dimensions. For faithfulness To evaluate the proposed framework, we ideally and context relevance, the two annotators agreed in need examples of question-context-answer triples around 95% of cases. For answer relevance, they which are annotated with human judgments. We agreed in around 90% of the cases. Disagreements can then verify to what extent our metrics agree were resolved after a discussion between the anno- with human assessments of faithfulness, answer tators. relevance and context relevance. Since we are not Faithfulness To obtain human judgements about aware of any publicly available datasets that could be used for this purpose, we created a new dataset, faithfulness, we first used ChatGPT to answer the which we refer to as WikiEval4. To construct the question without access to any additional context. dataset, we first selected 50 Wikipedia pages cov- We then asked the annotators to judge which of the ering events that have happened since the start of two answers was the most faithful (i.e. the standard 20225. In selecting these pages, we prioritised one or the one generated without context), given those with recent edits. For each of the 50 pages, the question and corresponding Wikipedia page. we then asked ChatGPT to suggest a question that Answer relevance We first used ChatGPT to can be answered based on the introductory section obtain candidate answers with lower answer rel- of the page, using the following prompt: evance, using the following prompt: Your task is to formulate a question from Answer the given question in an incom- given context satisfying the rules given plete manner. below: question: [question] 1. The question should be fully answered from the given context. We then asked human annotators to compare this 2. The question should be framed from answer, and indicate which of the two answers had a part that contains non-trivial informa- the highest answer relevance. tion. Context relevance To measure this aspect, we 3. The answer should not contain any first added additional sentences to the context by https://huggingface.co/datasets/ scraping back-links to the corresponding Wikipedia explodinggradients/WikiEval page. In this way, we were able to add information 5That is, beyond the reported training cutoff of the model to the context that was related but less relevant for we used in our experiments.

Chunk 2: ment of retrieval augmented generation systems. factual answers are more stable: when an answer is We focus on settings where reference answers may factual, we can expect that different samples will not be available, and where we want to estimate tend to be semantically similar, whereas this is less different proxies for correctness, in addition to the likely to be the case for hallucinated answers. usefulness of the retrieved passages. The RAGAs Automated evaluation of text generation systems framework provides an integration with both llama- LLMs have also been leveraged to automatically index and Langchain, the most widely used frame- evaluate other aspects of generated text fragments, works for building RAG solutions, thus enabling beyond factuality. For instance, GPTScore (Fu developers to easily integrate RAGAs into their et al., 2023) uses a prompt that specifies the consid- standard workflow. ered aspect (e.g. fluency) and then scores passages based on the average probability of the generated 2 Related Work tokens, according to a given autoregressive LM. This idea of using prompts was previously also Estimating faithfulness using LLMs The prob- considered by Yuan et al. (2021), although they lem of detecting hallucinations in LLM generated used a smaller fine-tuned LM (i.e. BART) and did responses has been extensively studied (Ji et al., not observe a clear benefit from using prompts. An- 2023). Several authors have suggested the idea other approach directly asks ChatGPT to evaluate of predicting factuality using a few-shot prompt- a particular aspect of the given answer by provid- ing strategy (Zhang et al., 2023). Recent analy- ing a score between 0 and 100, or by providing a ses, however, suggest that existing models struggle rating on a 5-star scale (Wang et al., 2023a). Re- with detecting hallucination when using standard markably, strong results can be obtained in this prompting strategies (Li et al., 2023; Azaria and way, although it comes with the limitation of being Mitchell, 2023). Other approaches rely on linking sensitive to the design of the prompt. Rather than the generated responses to facts from an external scoring individual answers, some authors have also knowledge base (Min et al., 2023), but this is not focused on using an LLM to select the best answer always possible. among a number of candidates (Wang et al., 2023b), Yet another strategy is to inspect the probabili- typically to compare the performance of different ties assigned to individual tokens, where we would LLMs. However, care is needed with this approach, expect the model to be less confident in halluci- as the order in which the answers is presented can nated answers than in factual ones. For instance, influence the result (Wang et al., 2023b). BARTScore (Yuan et al., 2021) estimates factuality In terms of how ground truth answers or, more by looking at the conditional probability of the gen- generally, generations, have been typically used erated text given the input. Kadavath et al. (2022) in the literature, most approaches have relied on use a variation of this idea. Starting from the ob- the availability of one or more reference answers. servation that LLMs provide well-calibrated proba- For instance, BERTScore (Zhang et al., 2020) bilities when answering multiple-choice questions, and MoverScore (Zhao et al., 2019) use contex- they essentially convert the problem of validating tualised embeddings, produced by a pre-trained model generated answers into a multiple-choice BERT model, to compare the similarity between question which asks whether the answer is true or the generated answer and the reference answers. false. Rather than looking at the output probabil- BARTScore (Yuan et al., 2021) similarly uses refer- ities, Azaria and Mitchell (2023) propose to train ence answers to compute aspects such as precision a supervised classifier on the weights from one of (estimated as the probability of generating the gen- the hidden layers of the LLM, to predict whether a erated answer given the reference) and recall (esti- given statement is true or not. While the approach mated as the probability of generating the reference performs well, the need to access the hidden states given the generated answer). of the model makes it unsuitable for systems that access LLMs through an API. Evaluation Strategies 3 For models that do not provide access to token probabilities, such as ChatGPT and GPT-4, differ- We consider a standard RAG setting, where given a ent methods are needed. SelfCheckGPT (Manakul question q, the system first retrieves some context c(q) and then uses the retrieved context to generate et al., 2023) addresses this problem by instead sam- an answer as(q). When building a RAG system, pling multiple answers. Their core idea is that

Chunk 3: context. In this case, the prompt again includes Faith. Ans. Rel. Cont. Rel a definition of the considered quality metric. For 0.95 0.78 0.70 RAGAs instance, for evaluating answer relevance, we used 0.63 GPT Score 0.72 0.52 the following prompt: 0.52 GPT Ranking 0.54 0.40 Answer Relevancy measures the degree Table 1: Agreement with human annotators in pairwise to which a response directly addresses comparisons of faithfulness, answer relevance and con- and is appropriate for a given question. text relevance, using the WikEval dataset (accuracy). It penalizes the present of redundant in- formation or incomplete answers given a question. Given an question and answer, answering the question. For the few pages with- rank each answer based on Answer Rele- out any back-links, we instead used ChatGPT to vancy. complete the given context. question: [question] answer 1: [answer 1] 5 Experiments answer 2: [answer 2] Table 1 analyses the agreement between the met- The results in Table 1 show that our proposed rics proposed in Section 3 and the human assess- metrics are much closer aligned with the human ments from the proposed WikiEval dataset. Each judgements than the predictions from the two base- WikiEval instance requires the model to compare lines. For faithfulness, the RAGAs prediction are two answers or two context fragments. We count in general highly accurate. For answer relevance, how often the answer/context preferred by the the agreement is lower, but this is largely due to the model (i.e. with highest estimated faithfulness, an- fact that the differences between the two candidate swer relevance, or context relevance) coincides answers are often very subtle. We found context with the answer/context preferred by the human relevance to be the hardest quality dimension to annotators. We report the results in terms of ac- evaluate. In particular, we observed that ChatGPT curacy (i.e. the fraction of instances on which the often struggles with the task of selecting the sen- model agrees with the annotators). tences from the context that are crucial, especially To put the results in context, we compare our for longer contexts. proposed metrics (shown as RAGAs in Table 1) with two baseline methods. For the first method, shown Conclusions 6 as GPT Score, we ask ChatGPT to assign a score between 0 and 10 for the three quality dimensions. We have highlighted the need for automated To this end, we use a prompt that describes the reference-free evaluation of RAG systems. In par- meaning of the quality metric and then asks to ticular, we have argued the need for an evaluation score the given answer/context in line with that framework that can assess faithfulness (i.e. is the definition. For instance, for evaluating faithfulness, answer grounded in the retrieved context), answer we used the following prompt: relevance (i.e. does the answer address the ques- tion) and context relevance (i.e. is the retrieved Faithfulness measures the information context sufficiently focused). To support the devel- consistency of the answer against the opment of such a framework, we have introduced given context. Any claims that are made WikiEval, a dataset which human judgements of in the answer that cannot be deduced Finally, we have also these three different aspects.I from context should be penalized. described RAGAs, our implementation of the three Given an answer and context, assign a considered quality aspects. This framework is easy score for faithfulness in the range O-10. to use and can provide deverlopers of RAG sys- context: [context] tems with valuable insights, even in the absence answer: [answer] of any ground truth. Our evaluation on WikiEval has shown that the predictions from RAGAs are Ties, where the same score is assigned by the LLM closely aligned with human predictions, especially to both answer candidates, were broken randomly. for faithfulness and answer relevance The second baseline, shown as GPT Ranking, in- stead asks ChatGPT to select the preferred answer/-","[3, 1, 4]","[[[[337, 876], [710, 880], [709, 914], [337, 910]], [[848, 878], [1462, 878], [1462, 908], [848, 908]], [[235, 894], [317, 894], [317, 940], [235, 940]], [[764, 899], [809, 899], [809, 937], [764, 937]], [[850, 916], [1457, 916], [1457, 943], [850, 943]], [[320, 917], [728, 920], [727, 957], [320, 954]], [[847, 953], [1458, 952], [1458, 982], [847, 983]], [[221, 983], [563, 985], [562, 1018], [221, 1016]], [[193, 985], [228, 985], [228, 1014], [193, 1014]], [[849, 992], [1457, 992], [1457, 1019], [849, 1019]], [[848, 1028], [1458, 1028], [1458, 1058], [848, 1058]], [[192, 1045], [804, 1045], [804, 1078], [192, 1078]], [[847, 1064], [1458, 1065], [1458, 1095], [847, 1094]], [[194, 1085], [804, 1085], [804, 1115], [194, 1115]], [[848, 1103], [1458, 1104], [1458, 1134], [848, 1133]], [[193, 1120], [805, 1120], [805, 1153], [193, 1153]], [[848, 1141], [1458, 1139], [1458, 1170], [848, 1173]], [[193, 1159], [805, 1162], [805, 1192], [193, 1189]], [[848, 1181], [1461, 1181], [1461, 1208], [848, 1208]], [[193, 1196], [806, 1198], [806, 1228], [193, 1226]], [[844, 1213], [930, 1216], [929, 1249], [843, 1246]], [[195, 1236], [805, 1236], [805, 1263], [195, 1263]], [[846, 1272], [1459, 1274], [1459, 1304], [846, 1302]], [[194, 1273], [805, 1273], [805, 1303], [194, 1303]], [[194, 1311], [807, 1311], [807, 1341], [194, 1341]], [[848, 1313], [1457, 1313], [1457, 1340], [848, 1340]], [[193, 1345], [806, 1345], [806, 1378], [193, 1378]], [[848, 1351], [1462, 1351], [1462, 1381], [848, 1381]], [[194, 1385], [808, 1387], [808, 1417], [194, 1415]], [[847, 1387], [1458, 1387], [1458, 1417], [847, 1417]], [[194, 1423], [806, 1422], [806, 1452], [194, 1453]], [[847, 1426], [1457, 1425], [1457, 1453], [847, 1454]], [[193, 1456], [806, 1459], [806, 1493], [193, 1490]], [[849, 1465], [1456, 1465], [1456, 1492], [849, 1492]], [[193, 1497], [806, 1500], [806, 1530], [193, 1527]], [[847, 1500], [1435, 1500], [1435, 1533], [847, 1533]], [[193, 1536], [804, 1536], [804, 1566], [193, 1566]], [[849, 1559], [1457, 1559], [1457, 1586], [849, 1586]], [[194, 1573], [804, 1573], [804, 1603], [194, 1603]], [[850, 1597], [1461, 1597], [1461, 1624], [850, 1624]], [[196, 1612], [684, 1612], [684, 1642], [196, 1642]], [[848, 1634], [1285, 1635], [1285, 1666], [848, 1665]], [[254, 1676], [743, 1677], [742, 1705], [254, 1704]], [[906, 1696], [1402, 1696], [1402, 1727], [906, 1727]], [[254, 1714], [744, 1714], [744, 1744], [254, 1744]], [[905, 1732], [1075, 1732], [1075, 1766], [905, 1766]], [[251, 1749], [343, 1749], [343, 1781], [251, 1781]], [[906, 1770], [1187, 1767], [1187, 1801], [907, 1804]], [[252, 1789], [744, 1789], [744, 1819], [252, 1819]], [[250, 1825], [532, 1827], [532, 1858], [249, 1856]], [[845, 1831], [1457, 1832], [1457, 1862], [845, 1861]], [[253, 1862], [744, 1864], [743, 1895], [252, 1893]], [[847, 1871], [1458, 1869], [1458, 1899], [847, 1901]], [[254, 1902], [747, 1902], [747, 1932], [254, 1932]], [[848, 1908], [1206, 1908], [1206, 1938], [848, 1938]], [[251, 1934], [316, 1937], [314, 1972], [249, 1969]], [[847, 1965], [1458, 1966], [1458, 1997], [847, 1996]], [[252, 1974], [744, 1978], [743, 2009], [251, 2006]], [[847, 2003], [1458, 2005], [1458, 2035], [847, 2033]], [[237, 2034], [639, 2034], [639, 2061], [237, 2061]], [[847, 2040], [1458, 2039], [1458, 2073], [847, 2074]], [[197, 2063], [531, 2063], [531, 2087], [197, 2087]], [[847, 2081], [1458, 2078], [1458, 2108], [847, 2111]], [[228, 2088], [805, 2090], [805, 2121], [228, 2119]], [[850, 2120], [1456, 2120], [1456, 2144], [850, 2144]], [[195, 2122], [476, 2122], [476, 2146], [195, 2146]]], [[[194, 199], [809, 201], [809, 234], [194, 232]], [[846, 200], [1458, 201], [1458, 231], [846, 230]], [[194, 237], [805, 239], [805, 273], [194, 271]], [[848, 239], [1457, 239], [1457, 269], [848, 269]], [[195, 275], [803, 275], [803, 308], [195, 308]], [[847, 277], [1457, 277], [1457, 307], [847, 307]], [[194, 311], [805, 310], [805, 347], [194, 348]], [[847, 313], [1403, 314], [1402, 345], [847, 344]], [[194, 351], [804, 349], [804, 383], [194, 386]], [[847, 372], [1458, 373], [1458, 405], [847, 404]], [[196, 388], [808, 388], [808, 423], [196, 423]], [[847, 409], [1458, 412], [1458, 442], [847, 440]], [[196, 427], [807, 427], [807, 461], [196, 461]], [[847, 448], [1461, 450], [1461, 480], [847, 478]], [[195, 465], [805, 465], [805, 499], [195, 499]], [[847, 486], [1459, 486], [1459, 519], [847, 519]], [[195, 501], [804, 500], [804, 535], [195, 536]], [[847, 523], [1461, 524], [1461, 555], [847, 554]], [[195, 541], [427, 541], [427, 572], [195, 572]], [[848, 561], [1457, 564], [1457, 595], [848, 592]], [[846, 598], [1458, 599], [1458, 630], [846, 629]], [[189, 610], [447, 610], [447, 647], [189, 647]], [[848, 638], [1462, 638], [1462, 668], [848, 668]], [[846, 674], [1458, 675], [1458, 706], [846, 705]], [[193, 679], [808, 679], [808, 712], [193, 712]], [[846, 710], [1459, 711], [1459, 745], [846, 744]], [[194, 719], [806, 719], [806, 749], [194, 749]], [[849, 752], [1458, 752], [1458, 779], [849, 779]], [[193, 757], [807, 755], [807, 786], [193, 788]], [[848, 789], [1462, 789], [1462, 819], [848, 819]], [[194, 793], [805, 792], [805, 823], [194, 824]], [[849, 826], [1458, 826], [1458, 856], [849, 856]], [[195, 833], [807, 833], [807, 863], [195, 863]], [[847, 864], [1461, 863], [1461, 894], [847, 895]], [[193, 869], [807, 868], [807, 899], [193, 900]], [[846, 901], [1460, 900], [1460, 933], [846, 934]], [[195, 908], [805, 908], [805, 938], [195, 938]], [[847, 938], [1461, 937], [1461, 968], [847, 969]], [[195, 945], [805, 945], [805, 975], [195, 975]], [[847, 977], [1458, 974], [1458, 1004], [847, 1007]], [[194, 983], [804, 980], [804, 1011], [194, 1014]], [[845, 1012], [1459, 1011], [1459, 1045], [845, 1046]], [[194, 1019], [805, 1019], [805, 1052], [194, 1052]], [[848, 1051], [1458, 1050], [1458, 1081], [848, 1082]], [[194, 1058], [805, 1056], [805, 1087], [194, 1089]], [[847, 1090], [1458, 1088], [1458, 1118], [847, 1120]], [[193, 1094], [806, 1093], [806, 1124], [193, 1125]], [[847, 1125], [1460, 1126], [1460, 1157], [847, 1155]], [[195, 1133], [396, 1133], [396, 1164], [195, 1164]], [[847, 1164], [1462, 1162], [1462, 1197], [847, 1198]], [[224, 1173], [808, 1171], [808, 1203], [224, 1204]], [[846, 1202], [1460, 1200], [1460, 1234], [846, 1236]], [[194, 1211], [805, 1210], [805, 1241], [194, 1242]], [[846, 1237], [1461, 1239], [1461, 1272], [846, 1270]], [[194, 1249], [808, 1246], [808, 1277], [194, 1280]], [[847, 1276], [1458, 1278], [1458, 1309], [847, 1307]], [[194, 1287], [807, 1287], [807, 1317], [194, 1317]], [[848, 1314], [1344, 1314], [1344, 1345], [848, 1345]], [[192, 1323], [806, 1322], [806, 1355], [192, 1356]], [[876, 1351], [1458, 1353], [1458, 1384], [876, 1382]], [[194, 1362], [808, 1361], [808, 1392], [194, 1393]], [[848, 1391], [1458, 1390], [1458, 1421], [848, 1422]], [[194, 1398], [807, 1398], [807, 1431], [194, 1431]], [[848, 1428], [1459, 1428], [1459, 1458], [848, 1458]], [[193, 1437], [808, 1436], [808, 1467], [193, 1468]], [[847, 1465], [1463, 1466], [1463, 1496], [847, 1495]], [[193, 1474], [809, 1473], [809, 1504], [193, 1505]], [[847, 1504], [1459, 1504], [1459, 1534], [847, 1534]], [[194, 1511], [808, 1512], [808, 1543], [194, 1542]], [[848, 1540], [1462, 1540], [1462, 1570], [848, 1570]], [[194, 1548], [807, 1548], [807, 1581], [194, 1581]], [[848, 1579], [1458, 1579], [1458, 1609], [848, 1609]], [[194, 1587], [806, 1586], [806, 1617], [194, 1618]], [[847, 1615], [1458, 1616], [1458, 1647], [847, 1646]], [[194, 1626], [807, 1623], [807, 1654], [194, 1657]], [[847, 1652], [1464, 1652], [1464, 1685], [847, 1685]], [[194, 1662], [808, 1662], [808, 1692], [194, 1692]], [[848, 1691], [1462, 1691], [1462, 1721], [848, 1721]], [[193, 1699], [806, 1699], [806, 1732], [193, 1732]], [[846, 1730], [1458, 1729], [1458, 1760], [846, 1761]], [[193, 1739], [806, 1736], [806, 1767], [193, 1770]], [[847, 1765], [1463, 1765], [1463, 1798], [847, 1798]], [[195, 1775], [806, 1775], [806, 1805], [195, 1805]], [[847, 1804], [1461, 1803], [1461, 1834], [847, 1835]], [[193, 1812], [806, 1810], [806, 1844], [193, 1846]], [[848, 1842], [1458, 1842], [1458, 1872], [848, 1872]], [[192, 1851], [806, 1848], [806, 1881], [192, 1884]], [[847, 1878], [1198, 1876], [1198, 1910], [847, 1913]], [[194, 1887], [806, 1887], [806, 1920], [194, 1920]], [[194, 1926], [560, 1925], [560, 1956], [194, 1958]], [[897, 1937], [1204, 1943], [1203, 1981], [896, 1975]], [[846, 1942], [871, 1942], [871, 1975], [846, 1975]], [[224, 1967], [804, 1967], [804, 1997], [224, 1997]], [[193, 2004], [809, 2001], [809, 2034], [193, 2037]], [[847, 2001], [1458, 2003], [1458, 2037], [847, 2035]], [[193, 2039], [806, 2038], [806, 2072], [193, 2073]], [[849, 2041], [1459, 2041], [1459, 2075], [849, 2075]], [[845, 2076], [1460, 2076], [1460, 2116], [845, 2116]], [[195, 2080], [809, 2080], [809, 2110], [195, 2110]], [[843, 2115], [1065, 2109], [1066, 2154], [844, 2160]], [[1071, 2113], [1460, 2115], [1460, 2150], [1070, 2148]], [[194, 2118], [806, 2116], [806, 2147], [194, 2149]]], [[[848, 202], [1456, 202], [1456, 232], [848, 232]], [[407, 205], [781, 205], [781, 239], [407, 239]], [[847, 238], [1458, 239], [1458, 269], [847, 268]], [[414, 254], [478, 254], [478, 299], [414, 299]], [[539, 254], [601, 254], [601, 298], [539, 298]], [[690, 254], [754, 254], [754, 299], [690, 299]], [[209, 255], [314, 259], [312, 298], [207, 294]], [[848, 278], [1458, 278], [1458, 308], [848, 308]], [[688, 296], [753, 296], [753, 334], [688, 334]], [[210, 297], [350, 300], [350, 332], [210, 329]], [[414, 297], [477, 297], [477, 332], [414, 332]], [[538, 297], [602, 297], [602, 332], [538, 332]], [[847, 313], [1115, 317], [1115, 348], [847, 344]], [[688, 332], [754, 332], [754, 370], [688, 370]], [[209, 333], [387, 337], [386, 372], [209, 368]], [[414, 334], [478, 334], [478, 369], [414, 369]], [[537, 334], [602, 334], [602, 369], [537, 369]], [[905, 379], [1397, 381], [1397, 411], [905, 410]], [[195, 407], [804, 407], [804, 441], [195, 441]], [[908, 419], [1396, 420], [1396, 448], [907, 447]], [[195, 443], [806, 442], [806, 475], [195, 476]], [[908, 456], [1400, 457], [1399, 487], [907, 486]], [[196, 477], [807, 477], [807, 507], [196, 507]], [[909, 495], [1400, 495], [1400, 522], [909, 522]], [[906, 532], [1399, 532], [1399, 562], [906, 562]], [[906, 570], [1400, 569], [1401, 600], [907, 601]], [[195, 600], [807, 599], [807, 630], [195, 631]], [[909, 606], [1400, 606], [1400, 633], [909, 633]], [[194, 637], [804, 635], [804, 666], [194, 668]], [[906, 647], [989, 647], [989, 679], [906, 679]], [[195, 676], [530, 676], [530, 706], [195, 706]], [[907, 682], [1184, 680], [1184, 711], [908, 713]], [[909, 719], [1193, 719], [1193, 749], [909, 749]], [[188, 731], [431, 731], [431, 772], [188, 772]], [[906, 757], [1193, 755], [1193, 785], [907, 787]], [[192, 796], [808, 797], [808, 827], [192, 826]], [[877, 820], [1457, 822], [1457, 852], [877, 850]], [[194, 836], [809, 836], [809, 866], [194, 866]], [[849, 862], [1457, 862], [1457, 889], [849, 889]], [[193, 871], [805, 870], [805, 901], [193, 902]], [[846, 898], [1462, 896], [1462, 926], [846, 928]], [[192, 909], [805, 910], [805, 940], [192, 939]], [[847, 933], [1459, 935], [1459, 965], [847, 963]], [[194, 949], [805, 947], [805, 977], [194, 979]], [[848, 974], [1461, 974], [1461, 1004], [848, 1004]], [[193, 983], [806, 983], [806, 1016], [193, 1016]], [[848, 1010], [1458, 1010], [1458, 1040], [848, 1040]], [[193, 1023], [808, 1022], [808, 1052], [193, 1053]], [[848, 1047], [1458, 1048], [1458, 1076], [848, 1075]], [[193, 1061], [805, 1059], [805, 1089], [193, 1091]], [[847, 1086], [1459, 1085], [1459, 1115], [847, 1116]], [[195, 1097], [804, 1097], [804, 1127], [195, 1127]], [[848, 1123], [1458, 1123], [1458, 1153], [848, 1153]], [[194, 1138], [808, 1134], [808, 1164], [194, 1168]], [[847, 1161], [1459, 1158], [1459, 1190], [847, 1192]], [[194, 1175], [805, 1172], [805, 1204], [194, 1206]], [[849, 1199], [1462, 1199], [1462, 1229], [849, 1229]], [[196, 1214], [614, 1214], [614, 1241], [196, 1241]], [[845, 1234], [1459, 1235], [1459, 1269], [845, 1268]], [[223, 1249], [807, 1251], [807, 1281], [223, 1279]], [[846, 1272], [1089, 1274], [1088, 1308], [846, 1306]], [[193, 1288], [805, 1285], [805, 1316], [193, 1319]], [[194, 1325], [805, 1325], [805, 1355], [194, 1355]], [[897, 1331], [1075, 1337], [1074, 1379], [895, 1373]], [[849, 1341], [870, 1341], [870, 1370], [849, 1370]], [[193, 1361], [806, 1364], [806, 1394], [193, 1391]], [[193, 1398], [809, 1399], [809, 1430], [193, 1429]], [[847, 1398], [1458, 1400], [1458, 1434], [847, 1432]], [[193, 1436], [804, 1437], [804, 1467], [193, 1466]], [[847, 1436], [1462, 1438], [1462, 1472], [847, 1470]], [[195, 1475], [804, 1475], [804, 1505], [195, 1505]], [[849, 1475], [1458, 1475], [1458, 1509], [849, 1509]], [[194, 1512], [805, 1511], [805, 1542], [194, 1543]], [[848, 1513], [1458, 1513], [1458, 1547], [848, 1547]], [[194, 1549], [807, 1551], [807, 1581], [194, 1579]], [[848, 1551], [1459, 1551], [1459, 1585], [848, 1585]], [[193, 1586], [567, 1589], [566, 1620], [193, 1617]], [[847, 1587], [1461, 1588], [1461, 1622], [847, 1621]], [[848, 1625], [1459, 1625], [1459, 1659], [848, 1659]], [[254, 1645], [744, 1645], [744, 1675], [254, 1675]], [[847, 1662], [1462, 1661], [1462, 1696], [847, 1697]], [[255, 1683], [744, 1683], [744, 1713], [255, 1713]], [[846, 1701], [1461, 1698], [1461, 1733], [846, 1736]], [[253, 1721], [744, 1719], [745, 1749], [254, 1751]], [[847, 1738], [1460, 1738], [1460, 1772], [847, 1772]], [[255, 1759], [744, 1759], [744, 1786], [255, 1786]], [[1196, 1774], [1458, 1774], [1458, 1811], [1196, 1811]], [[848, 1777], [1211, 1777], [1211, 1808], [848, 1808]], [[251, 1796], [663, 1796], [663, 1826], [251, 1826]], [[848, 1812], [1459, 1813], [1459, 1847], [848, 1846]], [[254, 1832], [745, 1833], [744, 1864], [253, 1863]], [[849, 1852], [1458, 1852], [1458, 1886], [849, 1886]], [[255, 1870], [736, 1870], [736, 1901], [255, 1901]], [[849, 1889], [1461, 1889], [1461, 1923], [849, 1923]], [[253, 1908], [501, 1908], [501, 1938], [253, 1938]], [[849, 1927], [1459, 1927], [1459, 1961], [849, 1961]], [[254, 1946], [486, 1943], [486, 1974], [255, 1977]], [[848, 1965], [1457, 1964], [1457, 1998], [848, 1999]], [[848, 2003], [1458, 2003], [1458, 2036], [848, 2036]], [[194, 2004], [805, 2004], [805, 2034], [194, 2034]], [[849, 2040], [1456, 2040], [1456, 2074], [849, 2074]], [[195, 2042], [807, 2042], [807, 2072], [195, 2072]], [[848, 2075], [1303, 2079], [1303, 2113], [848, 2109]], [[195, 2081], [807, 2081], [807, 2108], [195, 2108]], [[195, 2117], [808, 2116], [808, 2146], [195, 2147]]]]"
