question,answer,retrieved_texts,page_nums,bboxes
What are the three core quality metrics proposed by the RAGAS framework?,"The three core quality metrics proposed by the RAGAS framework are:

1. **Faithfulness**: Measures the consistency of the answer with the given context, penalizing claims that cannot be deduced from the context.

2. **Answer Relevance**: Assesses the degree to which a response directly addresses and is appropriate for the given question, penalizing redundant or incomplete answers.

3. **Context Relevance**: Evaluates whether the retrieved context is sufficiently focused and relevant to the question.","Chunk 1: context. In this case, the prompt again includes Faith. Ans. Rel. Cont. Rel a definition of the considered quality metric. For 0.95 0.78 0.70 RAGAs instance, for evaluating answer relevance, we used 0.63 GPT Score 0.72 0.52 the following prompt: 0.52 GPT Ranking 0.54 0.40 Answer Relevancy measures the degree Table 1: Agreement with human annotators in pairwise to which a response directly addresses comparisons of faithfulness, answer relevance and con- and is appropriate for a given question. text relevance, using the WikEval dataset (accuracy). It penalizes the present of redundant in- formation or incomplete answers given a question. Given an question and answer, answering the question. For the few pages with- rank each answer based on Answer Rele- out any back-links, we instead used ChatGPT to vancy. complete the given context. question: [question] answer 1: [answer 1] 5 Experiments answer 2: [answer 2] Table 1 analyses the agreement between the met- The results in Table 1 show that our proposed rics proposed in Section 3 and the human assess- metrics are much closer aligned with the human ments from the proposed WikiEval dataset. Each judgements than the predictions from the two base- WikiEval instance requires the model to compare lines. For faithfulness, the RAGAs prediction are two answers or two context fragments. We count in general highly accurate. For answer relevance, how often the answer/context preferred by the the agreement is lower, but this is largely due to the model (i.e. with highest estimated faithfulness, an- fact that the differences between the two candidate swer relevance, or context relevance) coincides answers are often very subtle. We found context with the answer/context preferred by the human relevance to be the hardest quality dimension to annotators. We report the results in terms of ac- evaluate. In particular, we observed that ChatGPT curacy (i.e. the fraction of instances on which the often struggles with the task of selecting the sen- model agrees with the annotators). tences from the context that are crucial, especially To put the results in context, we compare our for longer contexts. proposed metrics (shown as RAGAs in Table 1) with two baseline methods. For the first method, shown Conclusions 6 as GPT Score, we ask ChatGPT to assign a score between 0 and 10 for the three quality dimensions. We have highlighted the need for automated To this end, we use a prompt that describes the reference-free evaluation of RAG systems. In par- meaning of the quality metric and then asks to ticular, we have argued the need for an evaluation score the given answer/context in line with that framework that can assess faithfulness (i.e. is the definition. For instance, for evaluating faithfulness, answer grounded in the retrieved context), answer we used the following prompt: relevance (i.e. does the answer address the ques- tion) and context relevance (i.e. is the retrieved Faithfulness measures the information context sufficiently focused). To support the devel- consistency of the answer against the opment of such a framework, we have introduced given context. Any claims that are made WikiEval, a dataset which human judgements of in the answer that cannot be deduced Finally, we have also these three different aspects.I from context should be penalized. described RAGAs, our implementation of the three Given an answer and context, assign a considered quality aspects. This framework is easy score for faithfulness in the range O-10. to use and can provide deverlopers of RAG sys- context: [context] tems with valuable insights, even in the absence answer: [answer] of any ground truth. Our evaluation on WikiEval has shown that the predictions from RAGAs are Ties, where the same score is assigned by the LLM closely aligned with human predictions, especially to both answer candidates, were broken randomly. for faithfulness and answer relevance The second baseline, shown as GPT Ranking, in- stead asks ChatGPT to select the preferred answer/-

Chunk 2: Abstract struggle to memorise knowledge that is only rarely mentioned in the training corpus (Kandpal et al., We introduce RAGAs (Retrieval Augmented 2022; Mallen et al., 2023). The standard solution Generation Assessment),a framework for to these issues is to rely on Retrieval Augmented 210 3S 92 [T25] [6023 reference-free evaluation of Retrieval Aug- Generation (RAG) (Lee et al., 2019; Lewis et al. mented Generation (RAG) pipelines. RAG 2020; Guu et al., 2020). Answering a question systems are composed of a retrieval and an then essentially involves retrieving relevant pas- LLM based generation module, and provide LLMs with knowledge from a reference textual sages from a corpus and feeding these passages, database, which enables them to act as a natu- along with the original question, to the LM. While ral language layer between a user and textual initial approaches relied on specialised LMs for databases, reducing the risk of hallucinations. retrieval-augmented language modelling (Khandel- Evaluating RAG architectures is, however, chal- wal et al., 2020; Borgeaud et al., 2022), recent work lenging because there are several dimensions to has suggested that simply adding retrieved docu- consider: the ability of the retrieval system to ments to the input of a standard LM can also work identify relevant and focused context passages, well (Khattab et al., 2022; Ram et al., 2023; Shi the ability of the LLM to exploit such passages in a faithful way, or the quality of the gener- et al., 2023), thus making it possible to use retrieval- ation itself. With RAGAS, we put forward a augmented strategies in combination with LLMs suite of metrics which can be used to evaluate that are only available through APIs. these different dimensions without having to While the usefulness of retrieval-augmented rely on ground truth human annotations. We strategies is clear, their implementation requires posit that such a framework can crucially con- a significant amount of tuning, as the overall per- tribute to faster evaluation cycles of RAG archi- formance will be affected by the retrieval model, tectures, which is especially important given the considered corpus, the LM, or the prompt for- the fast adoption of LLMs. mulation, among others. Automated evaluation of Introduction 1 retrieval-augmented systems is thus paramount. In practice, RAG systems are often evaluated in terms Language Models (LMs) capture a vast amount of the language modelling task itself, i.e. by mea- of knowledge about the world, which allows them suring perplexity on some reference corpus. How- to answer questions without accessing any exter- ever, such evaluations are not always predictive nal sources. This idea of LMs as repositories of of downstream performance (Wang et al., 2023c). knowledge emerged shortly after the introduction Moreover, this evaluation strategy relies on the LM of BERT (Devlin et al., 2019) and became more probabilities, which are not accessible for some firmly established with the introduction of ever closed models (e.g. ChatGPT and GPT-4). Ques- larger LMs (Roberts et al., 2020). While the most tion answering is another common evaluation task, recent Large Language Models (LLMs) capture but usually only datasets with short extractive an- enough knowledge to rival human performance swers are considered, which may not be represen- across a wide variety of question answering bench- tative of how the system will be used. marks (Bubeck et al., 2023), the idea of using To address these issues, in this paper we present LLMs as knowledge bases still has two fundamen- RAGAs1, a framework for the automated assess- tal limitations. First, LLMs are not able to answer questions about events that have happened after 1RAGAs is available at https://github.com/ they were trained. Second, even the largest models explodinggradients/ragas.

Chunk 3: number of extracted sentences All questions were annotated along the three con- CR (2) sidered quality dimensions by two annotators. Both total number of sentences in c(q) annotators were fluent in English and were given The WikiEval Dataset 4 clear instructions about the meaning of the three considered quality dimensions. For faithfulness To evaluate the proposed framework, we ideally and context relevance, the two annotators agreed in need examples of question-context-answer triples around 95% of cases. For answer relevance, they which are annotated with human judgments. We agreed in around 90% of the cases. Disagreements can then verify to what extent our metrics agree were resolved after a discussion between the anno- with human assessments of faithfulness, answer tators. relevance and context relevance. Since we are not Faithfulness To obtain human judgements about aware of any publicly available datasets that could be used for this purpose, we created a new dataset, faithfulness, we first used ChatGPT to answer the which we refer to as WikiEval4. To construct the question without access to any additional context. dataset, we first selected 50 Wikipedia pages cov- We then asked the annotators to judge which of the ering events that have happened since the start of two answers was the most faithful (i.e. the standard 20225. In selecting these pages, we prioritised one or the one generated without context), given those with recent edits. For each of the 50 pages, the question and corresponding Wikipedia page. we then asked ChatGPT to suggest a question that Answer relevance We first used ChatGPT to can be answered based on the introductory section obtain candidate answers with lower answer rel- of the page, using the following prompt: evance, using the following prompt: Your task is to formulate a question from Answer the given question in an incom- given context satisfying the rules given plete manner. below: question: [question] 1. The question should be fully answered from the given context. We then asked human annotators to compare this 2. The question should be framed from answer, and indicate which of the two answers had a part that contains non-trivial informa- the highest answer relevance. tion. Context relevance To measure this aspect, we 3. The answer should not contain any first added additional sentences to the context by https://huggingface.co/datasets/ scraping back-links to the corresponding Wikipedia explodinggradients/WikiEval page. In this way, we were able to add information 5That is, beyond the reported training cutoff of the model to the context that was related but less relevant for we used in our experiments.","[4, 0, 3]","[[[[848, 202], [1456, 202], [1456, 232], [848, 232]], [[407, 205], [781, 205], [781, 239], [407, 239]], [[847, 238], [1458, 239], [1458, 269], [847, 268]], [[414, 254], [478, 254], [478, 299], [414, 299]], [[539, 254], [601, 254], [601, 298], [539, 298]], [[690, 254], [754, 254], [754, 299], [690, 299]], [[209, 255], [314, 259], [312, 298], [207, 294]], [[848, 278], [1458, 278], [1458, 308], [848, 308]], [[688, 296], [753, 296], [753, 334], [688, 334]], [[210, 297], [350, 300], [350, 332], [210, 329]], [[414, 297], [477, 297], [477, 332], [414, 332]], [[538, 297], [602, 297], [602, 332], [538, 332]], [[847, 313], [1115, 317], [1115, 348], [847, 344]], [[688, 332], [754, 332], [754, 370], [688, 370]], [[209, 333], [387, 337], [386, 372], [209, 368]], [[414, 334], [478, 334], [478, 369], [414, 369]], [[537, 334], [602, 334], [602, 369], [537, 369]], [[905, 379], [1397, 381], [1397, 411], [905, 410]], [[195, 407], [804, 407], [804, 441], [195, 441]], [[908, 419], [1396, 420], [1396, 448], [907, 447]], [[195, 443], [806, 442], [806, 475], [195, 476]], [[908, 456], [1400, 457], [1399, 487], [907, 486]], [[196, 477], [807, 477], [807, 507], [196, 507]], [[909, 495], [1400, 495], [1400, 522], [909, 522]], [[906, 532], [1399, 532], [1399, 562], [906, 562]], [[906, 570], [1400, 569], [1401, 600], [907, 601]], [[195, 600], [807, 599], [807, 630], [195, 631]], [[909, 606], [1400, 606], [1400, 633], [909, 633]], [[194, 637], [804, 635], [804, 666], [194, 668]], [[906, 647], [989, 647], [989, 679], [906, 679]], [[195, 676], [530, 676], [530, 706], [195, 706]], [[907, 682], [1184, 680], [1184, 711], [908, 713]], [[909, 719], [1193, 719], [1193, 749], [909, 749]], [[188, 731], [431, 731], [431, 772], [188, 772]], [[906, 757], [1193, 755], [1193, 785], [907, 787]], [[192, 796], [808, 797], [808, 827], [192, 826]], [[877, 820], [1457, 822], [1457, 852], [877, 850]], [[194, 836], [809, 836], [809, 866], [194, 866]], [[849, 862], [1457, 862], [1457, 889], [849, 889]], [[193, 871], [805, 870], [805, 901], [193, 902]], [[846, 898], [1462, 896], [1462, 926], [846, 928]], [[192, 909], [805, 910], [805, 940], [192, 939]], [[847, 933], [1459, 935], [1459, 965], [847, 963]], [[194, 949], [805, 947], [805, 977], [194, 979]], [[848, 974], [1461, 974], [1461, 1004], [848, 1004]], [[193, 983], [806, 983], [806, 1016], [193, 1016]], [[848, 1010], [1458, 1010], [1458, 1040], [848, 1040]], [[193, 1023], [808, 1022], [808, 1052], [193, 1053]], [[848, 1047], [1458, 1048], [1458, 1076], [848, 1075]], [[193, 1061], [805, 1059], [805, 1089], [193, 1091]], [[847, 1086], [1459, 1085], [1459, 1115], [847, 1116]], [[195, 1097], [804, 1097], [804, 1127], [195, 1127]], [[848, 1123], [1458, 1123], [1458, 1153], [848, 1153]], [[194, 1138], [808, 1134], [808, 1164], [194, 1168]], [[847, 1161], [1459, 1158], [1459, 1190], [847, 1192]], [[194, 1175], [805, 1172], [805, 1204], [194, 1206]], [[849, 1199], [1462, 1199], [1462, 1229], [849, 1229]], [[196, 1214], [614, 1214], [614, 1241], [196, 1241]], [[845, 1234], [1459, 1235], [1459, 1269], [845, 1268]], [[223, 1249], [807, 1251], [807, 1281], [223, 1279]], [[846, 1272], [1089, 1274], [1088, 1308], [846, 1306]], [[193, 1288], [805, 1285], [805, 1316], [193, 1319]], [[194, 1325], [805, 1325], [805, 1355], [194, 1355]], [[897, 1331], [1075, 1337], [1074, 1379], [895, 1373]], [[849, 1341], [870, 1341], [870, 1370], [849, 1370]], [[193, 1361], [806, 1364], [806, 1394], [193, 1391]], [[193, 1398], [809, 1399], [809, 1430], [193, 1429]], [[847, 1398], [1458, 1400], [1458, 1434], [847, 1432]], [[193, 1436], [804, 1437], [804, 1467], [193, 1466]], [[847, 1436], [1462, 1438], [1462, 1472], [847, 1470]], [[195, 1475], [804, 1475], [804, 1505], [195, 1505]], [[849, 1475], [1458, 1475], [1458, 1509], [849, 1509]], [[194, 1512], [805, 1511], [805, 1542], [194, 1543]], [[848, 1513], [1458, 1513], [1458, 1547], [848, 1547]], [[194, 1549], [807, 1551], [807, 1581], [194, 1579]], [[848, 1551], [1459, 1551], [1459, 1585], [848, 1585]], [[193, 1586], [567, 1589], [566, 1620], [193, 1617]], [[847, 1587], [1461, 1588], [1461, 1622], [847, 1621]], [[848, 1625], [1459, 1625], [1459, 1659], [848, 1659]], [[254, 1645], [744, 1645], [744, 1675], [254, 1675]], [[847, 1662], [1462, 1661], [1462, 1696], [847, 1697]], [[255, 1683], [744, 1683], [744, 1713], [255, 1713]], [[846, 1701], [1461, 1698], [1461, 1733], [846, 1736]], [[253, 1721], [744, 1719], [745, 1749], [254, 1751]], [[847, 1738], [1460, 1738], [1460, 1772], [847, 1772]], [[255, 1759], [744, 1759], [744, 1786], [255, 1786]], [[1196, 1774], [1458, 1774], [1458, 1811], [1196, 1811]], [[848, 1777], [1211, 1777], [1211, 1808], [848, 1808]], [[251, 1796], [663, 1796], [663, 1826], [251, 1826]], [[848, 1812], [1459, 1813], [1459, 1847], [848, 1846]], [[254, 1832], [745, 1833], [744, 1864], [253, 1863]], [[849, 1852], [1458, 1852], [1458, 1886], [849, 1886]], [[255, 1870], [736, 1870], [736, 1901], [255, 1901]], [[849, 1889], [1461, 1889], [1461, 1923], [849, 1923]], [[253, 1908], [501, 1908], [501, 1938], [253, 1938]], [[849, 1927], [1459, 1927], [1459, 1961], [849, 1961]], [[254, 1946], [486, 1943], [486, 1974], [255, 1977]], [[848, 1965], [1457, 1964], [1457, 1998], [848, 1999]], [[848, 2003], [1458, 2003], [1458, 2036], [848, 2036]], [[194, 2004], [805, 2004], [805, 2034], [194, 2034]], [[849, 2040], [1456, 2040], [1456, 2074], [849, 2074]], [[195, 2042], [807, 2042], [807, 2072], [195, 2072]], [[848, 2075], [1303, 2079], [1303, 2113], [848, 2109]], [[195, 2081], [807, 2081], [807, 2108], [195, 2108]], [[195, 2117], [808, 2116], [808, 2146], [195, 2147]]], [[[434, 591], [567, 593], [566, 628], [433, 626]], [[849, 597], [1458, 597], [1458, 627], [849, 627]], [[848, 633], [1460, 634], [1460, 665], [848, 664]], [[240, 655], [757, 657], [757, 694], [240, 692]], [[848, 671], [1458, 671], [1458, 701], [848, 701]], [[242, 691], [760, 691], [760, 725], [242, 725]], [[847, 708], [1459, 709], [1459, 740], [847, 739]], [[34, 722], [108, 722], [113, 1703], [39, 1703]], [[241, 726], [760, 726], [760, 760], [241, 760]], [[847, 746], [1460, 747], [1460, 778], [847, 777]], [[240, 758], [758, 756], [758, 790], [240, 792]], [[847, 782], [1458, 785], [1458, 816], [847, 813]], [[241, 794], [757, 791], [757, 822], [242, 825]], [[847, 821], [1462, 823], [1462, 854], [847, 852]], [[242, 825], [758, 825], [758, 858], [242, 858]], [[241, 858], [757, 860], [757, 891], [241, 889]], [[847, 859], [1461, 861], [1461, 892], [847, 890]], [[242, 891], [760, 893], [760, 923], [242, 921]], [[847, 896], [1460, 894], [1460, 927], [847, 929]], [[241, 925], [759, 925], [759, 958], [241, 958]], [[847, 933], [1461, 933], [1461, 966], [847, 966]], [[242, 959], [762, 959], [762, 989], [242, 989]], [[846, 971], [1462, 971], [1462, 1004], [846, 1004]], [[241, 992], [761, 992], [761, 1022], [241, 1022]], [[846, 1008], [1460, 1008], [1460, 1041], [846, 1041]], [[242, 1027], [758, 1027], [758, 1054], [242, 1054]], [[846, 1047], [1463, 1047], [1463, 1080], [846, 1080]], [[241, 1058], [758, 1060], [758, 1087], [241, 1085]], [[848, 1085], [1460, 1085], [1460, 1115], [848, 1115]], [[241, 1092], [760, 1093], [760, 1121], [241, 1120]], [[848, 1122], [1458, 1122], [1458, 1152], [848, 1152]], [[242, 1127], [758, 1127], [758, 1154], [242, 1154]], [[241, 1158], [761, 1161], [761, 1189], [241, 1186]], [[847, 1160], [1463, 1158], [1463, 1192], [847, 1193]], [[242, 1193], [759, 1193], [759, 1220], [242, 1220]], [[848, 1199], [1457, 1199], [1457, 1229], [848, 1229]], [[243, 1228], [757, 1228], [757, 1252], [243, 1252]], [[848, 1235], [1296, 1235], [1296, 1266], [848, 1266]], [[241, 1258], [757, 1260], [757, 1287], [241, 1285]], [[875, 1272], [1458, 1273], [1458, 1307], [875, 1306]], [[240, 1295], [758, 1292], [758, 1319], [241, 1322]], [[849, 1314], [1457, 1314], [1457, 1344], [849, 1344]], [[241, 1327], [760, 1326], [760, 1354], [241, 1355]], [[847, 1350], [1462, 1350], [1462, 1383], [847, 1383]], [[242, 1359], [760, 1358], [760, 1385], [242, 1386]], [[848, 1389], [1461, 1389], [1461, 1419], [848, 1419]], [[242, 1393], [757, 1393], [757, 1420], [242, 1420]], [[847, 1425], [1462, 1426], [1462, 1457], [847, 1456]], [[243, 1427], [542, 1427], [542, 1451], [243, 1451]], [[847, 1464], [1460, 1463], [1460, 1493], [847, 1494]], [[241, 1491], [427, 1491], [427, 1519], [241, 1519]], [[195, 1492], [217, 1492], [217, 1520], [195, 1520]], [[848, 1501], [1457, 1501], [1457, 1531], [848, 1531]], [[847, 1540], [1458, 1538], [1458, 1569], [847, 1571]], [[194, 1554], [804, 1554], [804, 1581], [194, 1581]], [[849, 1578], [1462, 1578], [1462, 1608], [849, 1608]], [[194, 1590], [805, 1590], [805, 1620], [194, 1620]], [[849, 1615], [1462, 1615], [1462, 1645], [849, 1645]], [[194, 1630], [807, 1630], [807, 1657], [194, 1657]], [[847, 1652], [1460, 1651], [1460, 1682], [847, 1683]], [[193, 1665], [807, 1665], [807, 1695], [193, 1695]], [[849, 1689], [1462, 1689], [1462, 1719], [849, 1719]], [[194, 1703], [805, 1703], [805, 1733], [194, 1733]], [[846, 1725], [1460, 1724], [1460, 1757], [846, 1758]], [[195, 1740], [806, 1740], [806, 1770], [195, 1770]], [[847, 1765], [1459, 1763], [1459, 1794], [847, 1796]], [[195, 1778], [806, 1778], [806, 1808], [195, 1808]], [[847, 1799], [1463, 1801], [1463, 1834], [847, 1832]], [[194, 1816], [806, 1816], [806, 1846], [194, 1846]], [[847, 1839], [1462, 1839], [1462, 1872], [847, 1872]], [[194, 1854], [805, 1854], [805, 1884], [194, 1884]], [[848, 1878], [1463, 1878], [1463, 1908], [848, 1908]], [[194, 1892], [806, 1892], [806, 1922], [194, 1922]], [[846, 1913], [1463, 1914], [1463, 1949], [846, 1947]], [[194, 1927], [808, 1927], [808, 1961], [194, 1961]], [[846, 1951], [1307, 1949], [1307, 1984], [846, 1985]], [[193, 1965], [806, 1965], [806, 1998], [193, 1998]], [[877, 1988], [1458, 1992], [1458, 2026], [877, 2023]], [[195, 2006], [808, 2006], [808, 2033], [195, 2033]], [[847, 2022], [1463, 2025], [1463, 2065], [847, 2062]], [[193, 2040], [807, 2042], [807, 2072], [193, 2070]], [[196, 2080], [806, 2080], [806, 2110], [196, 2110]], [[881, 2086], [1460, 2090], [1460, 2124], [881, 2120]], [[197, 2119], [804, 2119], [804, 2146], [197, 2146]], [[849, 2121], [1156, 2121], [1156, 2148], [849, 2148]]], [[[337, 876], [710, 880], [709, 914], [337, 910]], [[848, 878], [1462, 878], [1462, 908], [848, 908]], [[235, 894], [317, 894], [317, 940], [235, 940]], [[764, 899], [809, 899], [809, 937], [764, 937]], [[850, 916], [1457, 916], [1457, 943], [850, 943]], [[320, 917], [728, 920], [727, 957], [320, 954]], [[847, 953], [1458, 952], [1458, 982], [847, 983]], [[221, 983], [563, 985], [562, 1018], [221, 1016]], [[193, 985], [228, 985], [228, 1014], [193, 1014]], [[849, 992], [1457, 992], [1457, 1019], [849, 1019]], [[848, 1028], [1458, 1028], [1458, 1058], [848, 1058]], [[192, 1045], [804, 1045], [804, 1078], [192, 1078]], [[847, 1064], [1458, 1065], [1458, 1095], [847, 1094]], [[194, 1085], [804, 1085], [804, 1115], [194, 1115]], [[848, 1103], [1458, 1104], [1458, 1134], [848, 1133]], [[193, 1120], [805, 1120], [805, 1153], [193, 1153]], [[848, 1141], [1458, 1139], [1458, 1170], [848, 1173]], [[193, 1159], [805, 1162], [805, 1192], [193, 1189]], [[848, 1181], [1461, 1181], [1461, 1208], [848, 1208]], [[193, 1196], [806, 1198], [806, 1228], [193, 1226]], [[844, 1213], [930, 1216], [929, 1249], [843, 1246]], [[195, 1236], [805, 1236], [805, 1263], [195, 1263]], [[846, 1272], [1459, 1274], [1459, 1304], [846, 1302]], [[194, 1273], [805, 1273], [805, 1303], [194, 1303]], [[194, 1311], [807, 1311], [807, 1341], [194, 1341]], [[848, 1313], [1457, 1313], [1457, 1340], [848, 1340]], [[193, 1345], [806, 1345], [806, 1378], [193, 1378]], [[848, 1351], [1462, 1351], [1462, 1381], [848, 1381]], [[194, 1385], [808, 1387], [808, 1417], [194, 1415]], [[847, 1387], [1458, 1387], [1458, 1417], [847, 1417]], [[194, 1423], [806, 1422], [806, 1452], [194, 1453]], [[847, 1426], [1457, 1425], [1457, 1453], [847, 1454]], [[193, 1456], [806, 1459], [806, 1493], [193, 1490]], [[849, 1465], [1456, 1465], [1456, 1492], [849, 1492]], [[193, 1497], [806, 1500], [806, 1530], [193, 1527]], [[847, 1500], [1435, 1500], [1435, 1533], [847, 1533]], [[193, 1536], [804, 1536], [804, 1566], [193, 1566]], [[849, 1559], [1457, 1559], [1457, 1586], [849, 1586]], [[194, 1573], [804, 1573], [804, 1603], [194, 1603]], [[850, 1597], [1461, 1597], [1461, 1624], [850, 1624]], [[196, 1612], [684, 1612], [684, 1642], [196, 1642]], [[848, 1634], [1285, 1635], [1285, 1666], [848, 1665]], [[254, 1676], [743, 1677], [742, 1705], [254, 1704]], [[906, 1696], [1402, 1696], [1402, 1727], [906, 1727]], [[254, 1714], [744, 1714], [744, 1744], [254, 1744]], [[905, 1732], [1075, 1732], [1075, 1766], [905, 1766]], [[251, 1749], [343, 1749], [343, 1781], [251, 1781]], [[906, 1770], [1187, 1767], [1187, 1801], [907, 1804]], [[252, 1789], [744, 1789], [744, 1819], [252, 1819]], [[250, 1825], [532, 1827], [532, 1858], [249, 1856]], [[845, 1831], [1457, 1832], [1457, 1862], [845, 1861]], [[253, 1862], [744, 1864], [743, 1895], [252, 1893]], [[847, 1871], [1458, 1869], [1458, 1899], [847, 1901]], [[254, 1902], [747, 1902], [747, 1932], [254, 1932]], [[848, 1908], [1206, 1908], [1206, 1938], [848, 1938]], [[251, 1934], [316, 1937], [314, 1972], [249, 1969]], [[847, 1965], [1458, 1966], [1458, 1997], [847, 1996]], [[252, 1974], [744, 1978], [743, 2009], [251, 2006]], [[847, 2003], [1458, 2005], [1458, 2035], [847, 2033]], [[237, 2034], [639, 2034], [639, 2061], [237, 2061]], [[847, 2040], [1458, 2039], [1458, 2073], [847, 2074]], [[197, 2063], [531, 2063], [531, 2087], [197, 2087]], [[847, 2081], [1458, 2078], [1458, 2108], [847, 2111]], [[228, 2088], [805, 2090], [805, 2121], [228, 2119]], [[850, 2120], [1456, 2120], [1456, 2144], [850, 2144]], [[195, 2122], [476, 2122], [476, 2146], [195, 2146]]]]"
